{
  "schema_version": "gameplay.experience_budget.v1",
  "budget_id": "REPLACE_WITH_STABLE_BUDGET_ID",
  "sheet_binding": {
    "path": "design/gameplay/experience_beat_sheets/REPLACE.md",
    "sheet_id": "REPLACE",
    "version_token": "REPLACE",
    "checksum": "sha256:REPLACE"
  },
  "exact_span": {
    "start_boundary": {
      "boundary_id": "REPLACE_EXACT_RUNTIME_START",
      "match": { "event_id": "REPLACE_START_EVENT_ID" }
    },
    "end_boundary": {
      "boundary_id": "REPLACE_EXACT_RUNTIME_END",
      "match": { "event_id": "REPLACE_END_EVENT_ID" }
    }
  },
  "thresholds": {
    "first_play_duration_ms": {
      "target": 60000,
      "minimum": 45000,
      "maximum": 75000
    },
    "replay_target_duration_ms": 45000,
    "minimum_player_control_ratio": 0.65,
    "maximum_presentation_only_gap_ms": 8000,
    "maximum_traversal_only_gap_ms": 8000,
    "content_counts": {
      "complete_gameplay_beats": { "minimum": 1, "maximum": 3 },
      "meaningful_decisions": { "minimum": 0, "maximum": 2 },
      "combat_encounters": { "minimum": 0, "maximum": 2 },
      "world_interactions": { "minimum": 0, "maximum": 3 },
      "narrative_presentations": { "minimum": 0, "maximum": 3 }
    },
    "narrative_presentation_time_ms": { "minimum": 0, "maximum": 15000 }
  },
  "interval_selectors": {
    "player_control": [
      {
        "interval_id": "REPLACE_CONTROL_INTERVAL",
        "start_match": { "event_id": "REPLACE_CONTROL_START_EVENT" },
        "end_match": { "event_id": "REPLACE_CONTROL_END_EVENT" }
      }
    ],
    "presentation": [],
    "traversal": []
  },
  "gameplay_measurements": [
    {
      "measurement_id": "REPLACE_GAMEPLAY_BEAT_MEASUREMENT",
      "kernel_id": "REPLACE_ACCEPTANCE_KERNEL_ID",
      "categories": ["complete_gameplay_beat"]
    }
  ],
  "non_gameplay_activity_selectors": []
}
